{
  "$schema": "./agent-tools.schema.json",
  "catalog": "b2c-finance-agent-tools",
  "version": "1.0.0",
  "apiVersion": "v1",
  "readOnly": true,
  "description": "Ferramentas que o AI Agent do n8n pode chamar na API B2C Finance V1. Todas são SOMENTE LEITURA (GET). Cada ferramenta aponta para um endpoint da OpenAPI (/api/openapi.json) e exige o scope indicado na integração (Configurações → Integrações). O teste tests/integracao-n8n.test.ts confere este arquivo contra a OpenAPI.",
  "conventions": {
    "baseUrl": "Variável B2C_FINANCE_API_URL (ex.: https://b2-c-finance.vercel.app/api/v1).",
    "auth": "Credencial Header Auth do n8n: Authorization = Bearer <token da integração>.",
    "headers": { "X-B2C-Source": "whatsapp" },
    "dates": "Datas AAAA-MM-DD; competência AAAA-MM; fuso America/Bahia.",
    "money": "Valores em reais (número, 2 casas).",
    "emptyOptional": "Parâmetro opcional em branco é tratado como ausente pela API."
  },
  "tools": [
    {
      "name": "buscar_clientes",
      "description": "Encontra clientes pelo nome, razão social ou parte do CNPJ/CPF. SEMPRE use antes de qualquer consulta sobre um cliente citado pelo nome. Ignora acento e maiúsculas. Se vier mais de um resultado, pergunte ao usuário qual é (mostre nome, razão social e documento mascarado); nunca escolha sozinho. Devolve id, nome, razão social, documento mascarado, status de hoje e modalidade.",
      "scope": "clients.read",
      "http": { "method": "GET", "path": "/search", "query": ["q", "limit"], "fixedQuery": { "type": "client" } },
      "inputSchema": {
        "type": "object",
        "properties": {
          "q": { "type": "string", "minLength": 2, "maxLength": 100, "description": "Texto buscado, como o usuário escreveu (ex.: \"face love\")." },
          "limit": { "type": "integer", "minimum": 1, "maximum": 25, "default": 10, "description": "Máximo de resultados." }
        },
        "required": ["q"],
        "additionalProperties": false
      },
      "responsePath": "data[]"
    },
    {
      "name": "consultar_cliente",
      "description": "Detalhe de UM cliente pelo id (obtido em buscar_clientes): cadastro, contatos, responsável, valores, prazo, próxima renovação, status de hoje, alteração programada e situação financeira (em aberto, vencido, próximo vencimento). Com competence, traz também o status daquele mês.",
      "scope": "clients.read",
      "http": { "method": "GET", "path": "/clients/{id}", "pathParams": ["id"], "query": ["competence"] },
      "inputSchema": {
        "type": "object",
        "properties": {
          "id": { "type": "string", "description": "Id do cliente (de buscar_clientes)." },
          "competence": { "type": "string", "pattern": "^\\d{4}-(0[1-9]|1[0-2])$", "description": "Opcional. Mês AAAA-MM para saber o status NAQUELE mês." }
        },
        "required": ["id"],
        "additionalProperties": false
      },
      "responsePath": "data"
    },
    {
      "name": "consultar_status_cliente",
      "description": "Histórico de status do cliente com vigência (de quando até quando cada status valeu) e alterações programadas. Use para perguntas como \"desde quando está inativo?\" ou \"estava ativo em março?\". Mudar o status em outubro não altera setembro.",
      "scope": "client_status.read",
      "http": { "method": "GET", "path": "/clients/{id}/status-history", "pathParams": ["id"], "query": [] },
      "inputSchema": {
        "type": "object",
        "properties": {
          "id": { "type": "string", "description": "Id do cliente (de buscar_clientes)." }
        },
        "required": ["id"],
        "additionalProperties": false
      },
      "responsePath": "data"
    },
    {
      "name": "consultar_dashboard",
      "description": "Indicadores oficiais de um mês: faturamento, MRR, TCV, recebido, em aberto, vencido, resultado, margem, clientes ativos, novos, churn (quantidade e valor), ticket médio. Sem competence = mês atual (números parciais).",
      "scope": "dashboard.read",
      "http": { "method": "GET", "path": "/dashboard/summary", "query": ["competence"] },
      "inputSchema": {
        "type": "object",
        "properties": {
          "competence": { "type": "string", "pattern": "^\\d{4}-(0[1-9]|1[0-2])$", "description": "Mês AAAA-MM. Padrão: o atual." }
        },
        "additionalProperties": false
      },
      "responsePath": "data"
    },
    {
      "name": "consultar_recebimentos",
      "description": "Cobranças (recebimentos). Filtre por cliente (clientId de buscar_clientes), status e janela. status aceita vários separados por vírgula: UPCOMING, PAID, PAID_LATE, PAID_OTHER_MONTH, OVERDUE, DELINQUENT, PARTIAL, REMOVED, RENEGOTIATED, ou o atalho open (tudo que ainda tem saldo). Janela: competence (padrão: mês atual) OU dateFrom+dateTo (vencimento). meta.totals traz a soma do filtro inteiro — use para responder \"quanto\".",
      "scope": "receivables.read",
      "http": { "method": "GET", "path": "/receivables", "query": ["clientId", "status", "competence", "dateFrom", "dateTo", "page", "pageSize"] },
      "inputSchema": {
        "type": "object",
        "properties": {
          "clientId": { "type": "string", "description": "Só deste cliente." },
          "status": { "type": "string", "description": "Ex.: open, OVERDUE, \"PAID,PAID_LATE\"." },
          "competence": { "type": "string", "pattern": "^\\d{4}-(0[1-9]|1[0-2])$", "description": "Mês AAAA-MM (não use junto com dateFrom/dateTo)." },
          "dateFrom": { "type": "string", "format": "date", "description": "Vencimento a partir de (AAAA-MM-DD), junto com dateTo." },
          "dateTo": { "type": "string", "format": "date", "description": "Vencimento até (AAAA-MM-DD), junto com dateFrom." },
          "page": { "type": "integer", "minimum": 1, "default": 1 },
          "pageSize": { "type": "integer", "minimum": 1, "maximum": 200, "default": 50 }
        },
        "additionalProperties": false
      },
      "responsePath": "data[] + meta.totals"
    },
    {
      "name": "consultar_despesas",
      "description": "Despesas (contas a pagar) pela data do lançamento — padrão: mês atual. status: pendente, pago, cancelado ou vencida (pendente com vencimento passado). category aceita o nome da categoria. meta.totalAmount soma o filtro inteiro.",
      "scope": "expenses.read",
      "http": { "method": "GET", "path": "/expenses", "query": ["status", "dateFrom", "dateTo", "category", "page", "pageSize"] },
      "inputSchema": {
        "type": "object",
        "properties": {
          "status": { "type": "string", "enum": ["pendente", "pago", "cancelado", "vencida"] },
          "dateFrom": { "type": "string", "format": "date", "description": "AAAA-MM-DD, junto com dateTo." },
          "dateTo": { "type": "string", "format": "date", "description": "AAAA-MM-DD, junto com dateFrom." },
          "category": { "type": "string", "description": "Nome ou id da categoria." },
          "page": { "type": "integer", "minimum": 1, "default": 1 },
          "pageSize": { "type": "integer", "minimum": 1, "maximum": 200, "default": 50 }
        },
        "additionalProperties": false
      },
      "responsePath": "data[] + meta.totalAmount"
    },
    {
      "name": "consultar_caixa",
      "description": "Posição de caixa: saldo das contas, compromissos a pagar na janela, disponível, entradas e saídas previstas em 30 dias e saldo projetado (a receber vencido fica fora da projeção e vem separado).",
      "scope": "cash.read",
      "http": { "method": "GET", "path": "/cash/summary", "query": [] },
      "inputSchema": { "type": "object", "properties": {}, "additionalProperties": false },
      "responsePath": "data"
    },
    {
      "name": "consultar_upsells",
      "description": "Oportunidades de upsell (venda adicional). status: OPPORTUNITY, NEGOTIATION, WON, LOST, PAUSED. responsible é o NOME do responsável. meta.totalValue soma o valor potencial do filtro.",
      "scope": "upsells.read",
      "http": { "method": "GET", "path": "/upsells", "query": ["status", "clientId", "responsible", "page", "pageSize"] },
      "inputSchema": {
        "type": "object",
        "properties": {
          "status": { "type": "string", "enum": ["OPPORTUNITY", "NEGOTIATION", "WON", "LOST", "PAUSED"] },
          "clientId": { "type": "string", "description": "Id do cliente (de buscar_clientes)." },
          "responsible": { "type": "string", "description": "Nome do responsável." },
          "page": { "type": "integer", "minimum": 1, "default": 1 },
          "pageSize": { "type": "integer", "minimum": 1, "maximum": 200, "default": 50 }
        },
        "additionalProperties": false
      },
      "responsePath": "data[] + meta.totalValue"
    },
    {
      "name": "consultar_rotina",
      "description": "Rotina do dia: ações prioritárias (com chave e se já foi concluída), cobranças vencidas e a vencer, pagamentos vencidos e a vencer, renovações pendentes do mês, caixa e upsells abertos. Use para \"o que tenho para hoje?\".",
      "scope": "routine.read",
      "http": { "method": "GET", "path": "/routine/daily", "query": [] },
      "inputSchema": { "type": "object", "properties": {}, "additionalProperties": false },
      "responsePath": "data"
    },
    {
      "name": "gerar_relatorio_diario",
      "description": "Resumo de um dia: cobranças que vencem e pagamentos recebidos; despesas do dia e despesas pagas no dia; mudanças de status (com vigência no dia e registradas no dia); clientes com entrada e cadastrados no dia; upsells criados e vendidos no dia. Seções sem permissão vêm listadas em meta.omittedSections — diga que não tem acesso, nunca que é zero.",
      "scope": "reports.read",
      "http": { "method": "GET", "path": "/reports/daily", "query": ["date"] },
      "inputSchema": {
        "type": "object",
        "properties": {
          "date": { "type": "string", "format": "date", "description": "Dia AAAA-MM-DD. Padrão: hoje." }
        },